{
  "schema_version": 1,
  "report_date": "2026-08-17",
  "run_slot": "scheduled",
  "requested_mode": "auto",
  "mode": "scheduled",
  "sourcing_run_type": "scheduled",
  "status": "success",
  "scan_complete": true,
  "artifact_path": "data/steam_review_opportunities/2026-08-17.json",
  "artifact_sha256": "f1ac76da004bd1fc5bb7a7611e0d5a369d254234d4550be92f7a42da088918a3",
  "catalog_scan_count": 139875,
  "catalog_entries_seen": 169544,
  "qualified_count": 367,
  "previously_qualified_count": 367,
  "import_candidate_count": 0,
  "deduplicated_count": 0,
  "created_count": 0,
  "updated_count": 0,
  "failure_reason": null,
  "run_id": "31968225581",
  "run_number": "10",
  "run_url": "https://github.com/Neo0109/CRM/actions/runs/31968225581",
  "head_sha": "d0c096cf3f74416af4df1944439849f118b45b8b",
  "captured_at": "2026-08-16T21:24:16.821Z",
  "sync_response": {
    "synced": true,
    "created": 0,
    "skipped_existing": 0,
    "updated": 0,
    "dropped": 0,
    "total": 1000,
    "import_stats": {
      "created_unprocessed": 0,
      "created_dropped": 0,
      "created_other": 0,
      "updated_unprocessed_visible": 0,
      "updated_existing_workflow": 0,
      "updated_dropped": 0,
      "updated_other": 0,
      "visible_unprocessed": 0,
      "stale_updates": 0
    },
    "report_date": "2026-08-17",
    "summary": "V7.1 Steam review opportunities: 367 qualified, 0 eligible for create-only import."
  }
}
