{
  "schema_version": 1,
  "report_date": "2026-07-16",
  "run_slot": "pr6-final-acceptance-hotfix",
  "requested_mode": "backfill",
  "mode": "backfill",
  "sourcing_run_type": "initial_backfill",
  "status": "sync_failed",
  "scan_complete": true,
  "artifact_path": "data/steam_review_opportunities/2026-07-16.json",
  "artifact_sha256": "d96326998d302139c20d24583f64dd44215d4b2446ef43e36a54b016daf7add7",
  "catalog_scan_count": 134957,
  "catalog_entries_seen": 164941,
  "qualified_count": 366,
  "previously_qualified_count": 0,
  "import_candidate_count": 366,
  "deduplicated_count": 0,
  "created_count": 0,
  "updated_count": 0,
  "failure_reason": "sync_not_completed",
  "run_id": "29488582581",
  "run_number": "4",
  "run_url": "https://github.com/Neo0109/CRM/actions/runs/29488582581",
  "head_sha": "096ad024c222746ae2ffcc0e24d0e0ae723ac25b",
  "captured_at": "2026-07-16T11:29:46.989Z",
  "sync_response": {
    "synced": false,
    "reason": "sync_not_completed"
  }
}
