{
  "schema_version": 1,
  "report_date": "2026-07-16",
  "run_slot": "pr6-hotfix-acceptance",
  "requested_mode": "backfill",
  "mode": "backfill",
  "sourcing_run_type": "initial_backfill",
  "status": "scan_incomplete",
  "scan_complete": false,
  "artifact_path": "data/steam_review_opportunities/2026-07-16.json",
  "artifact_sha256": "00b9e85c1a70962793d4445a0e8719f8a10bc017c68dabad2d49ef38bb3f2e2b",
  "catalog_scan_count": 136803,
  "catalog_entries_seen": 164914,
  "qualified_count": 365,
  "previously_qualified_count": 0,
  "import_candidate_count": 0,
  "deduplicated_count": 0,
  "created_count": 0,
  "updated_count": 0,
  "failure_reason": "scan_incomplete",
  "run_id": "29474396300",
  "run_number": "2",
  "run_url": "https://github.com/Neo0109/CRM/actions/runs/29474396300",
  "head_sha": "3216d0b5084f184594185c8dabe6658956fe5f90",
  "captured_at": "2026-07-16T06:56:22.877Z",
  "sync_response": {
    "synced": false,
    "reason": "scan_incomplete"
  }
}
