{
  "schema_version": 1,
  "report_date": "2026-10-19",
  "run_slot": "scheduled",
  "requested_mode": "auto",
  "mode": "scheduled",
  "sourcing_run_type": "scheduled",
  "status": "scan_incomplete",
  "scan_complete": false,
  "artifact_path": "data/steam_review_opportunities/2026-10-19.json",
  "artifact_sha256": "df110f2c61ac4affea9fcf08d69d6c7c3c1dbdb1a791350aafea119f491bf70b",
  "catalog_scan_count": 148522,
  "catalog_entries_seen": 183546,
  "qualified_count": 366,
  "previously_qualified_count": 0,
  "import_candidate_count": 0,
  "deduplicated_count": 0,
  "created_count": 0,
  "updated_count": 0,
  "failure_reason": "scan_incomplete",
  "run_id": "39168510407",
  "run_number": "19",
  "run_url": "https://github.com/Neo0109/CRM/actions/runs/39168510407",
  "head_sha": "7144b2052acab1a60264b07f835c47cf2860125a",
  "captured_at": "2026-10-18T23:24:39.641Z",
  "sync_response": {
    "synced": false,
    "reason": "scan_incomplete"
  }
}
